      PDCM: perfmon and debug                 = true
      HWP energy performance preference       = true
      performance-energy bias capability      = true
      performance capability reporting        = true
   Architecture Performance Monitoring Features (0xa/eax):
   Architecture Performance Monitoring Features (0xa/ebx):
   Architecture Performance Monitoring Features (0xa/edx):
      CPB: core performance boost             = false
      performance time-stamp counter size = 0x0 (0)
      PDCM: perfmon and debug                 = true
      HWP energy performance preference       = true
      performance-energy bias capability      = true
      performance capability reporting        = true
   Architecture Performance Monitoring Features (0xa/eax):
   Architecture Performance Monitoring Features (0xa/ebx):
   Architecture Performance Monitoring Features (0xa/edx):
      CPB: core performance boost             = false
      performance time-stamp counter size = 0x0 (0)
      PDCM: perfmon and debug                 = true
      HWP energy performance preference       = true
      performance-energy bias capability      = true
      performance capability reporting        = true
   Architecture Performance Monitoring Features (0xa/eax):
   Architecture Performance Monitoring Features (0xa/ebx):
   Architecture Performance Monitoring Features (0xa/edx):
      CPB: core performance boost             = false
      performance time-stamp counter size = 0x0 (0)
      PDCM: perfmon and debug                 = true
      HWP energy performance preference       = true
      performance-energy bias capability      = true
      performance capability reporting        = true
   Architecture Performance Monitoring Features (0xa/eax):
   Architecture Performance Monitoring Features (0xa/ebx):
   Architecture Performance Monitoring Features (0xa/edx):
      CPB: core performance boost             = false
      performance time-stamp counter size = 0x0 (0)
      PDCM: perfmon and debug                 = true
      HWP energy performance preference       = true
      performance-energy bias capability      = true
      performance capability reporting        = true
   Architecture Performance Monitoring Features (0xa/eax):
   Architecture Performance Monitoring Features (0xa/ebx):
   Architecture Performance Monitoring Features (0xa/edx):
      CPB: core performance boost             = false
      performance time-stamp counter size = 0x0 (0)
      PDCM: perfmon and debug                 = true
      HWP energy performance preference       = true
      performance-energy bias capability      = true
      performance capability reporting        = true
   Architecture Performance Monitoring Features (0xa/eax):
   Architecture Performance Monitoring Features (0xa/ebx):
   Architecture Performance Monitoring Features (0xa/edx):
      CPB: core performance boost             = false
      performance time-stamp counter size = 0x0 (0)
      PDCM: perfmon and debug                 = true
      HWP energy performance preference       = true
      performance-energy bias capability      = true
      performance capability reporting        = true
   Architecture Performance Monitoring Features (0xa/eax):
   Architecture Performance Monitoring Features (0xa/ebx):
   Architecture Performance Monitoring Features (0xa/edx):
      CPB: core performance boost             = false
      performance time-stamp counter size = 0x0 (0)
      PDCM: perfmon and debug                 = true
      HWP energy performance preference       = true
      performance-energy bias capability      = true
      performance capability reporting        = true
   Architecture Performance Monitoring Features (0xa/eax):
   Architecture Performance Monitoring Features (0xa/ebx):
   Architecture Performance Monitoring Features (0xa/edx):
      CPB: core performance boost             = false
      performance time-stamp counter size = 0x0 (0)
      PDCM: perfmon and debug                 = true
      HWP energy performance preference       = true
      performance-energy bias capability      = true
      performance capability reporting        = true
   Architecture Performance Monitoring Features (0xa/eax):
   Architecture Performance Monitoring Features (0xa/ebx):
   Architecture Performance Monitoring Features (0xa/edx):
      CPB: core performance boost             = false
      performance time-stamp counter size = 0x0 (0)
      PDCM: perfmon and debug                 = true
      HWP energy performance preference       = true
      performance-energy bias capability      = true
      performance capability reporting        = true
   Architecture Performance Monitoring Features (0xa/eax):
   Architecture Performance Monitoring Features (0xa/ebx):
   Architecture Performance Monitoring Features (0xa/edx):
      CPB: core performance boost             = false
      performance time-stamp counter size = 0x0 (0)
      PDCM: perfmon and debug                 = true
      HWP energy performance preference       = true
      performance-energy bias capability      = true
      performance capability reporting        = true
   Architecture Performance Monitoring Features (0xa/eax):
   Architecture Performance Monitoring Features (0xa/ebx):
   Architecture Performance Monitoring Features (0xa/edx):
      CPB: core performance boost             = false
      performance time-stamp counter size = 0x0 (0)
      PDCM: perfmon and debug                 = true
      HWP energy performance preference       = true
      performance-energy bias capability      = true
      performance capability reporting        = true
   Architecture Performance Monitoring Features (0xa/eax):
   Architecture Performance Monitoring Features (0xa/ebx):
   Architecture Performance Monitoring Features (0xa/edx):
      CPB: core performance boost             = false
      performance time-stamp counter size = 0x0 (0)
